{
  "$schema": "https://json-schema.org/draft/2020-12/schema",
  "$id": "rgcs://schemas/optical_probe.schema.json",
  "title": "RGCS optical probe configuration",
  "description": "One optical probe arm for a run (Agent 06). Binding rules: the pre-registered null expectation for every directional observable is NO asymmetry (DECISION_LOG D6-003); any directional claim requires the full reversal battery (beam reversal, polarization flip, coil phase flip, sham timing) plus a heating control at matched absorbed power; laser safety class and interlock are mandatory metadata; no beam parameter here authorizes exceeding laser-class limits or human exposure.",
  "type": "object",
  "required": ["probe_id", "beam", "path", "direction", "expected_mechanisms", "controls", "hypothesis_ids"],
  "additionalProperties": false,
  "properties": {
    "probe_id": { "type": "string", "pattern": "^OPT-[A-Za-z0-9_.-]+$" },
    "beam": {
      "type": "object",
      "required": ["wavelength_nm", "power_mw", "laser_class", "interlock_present"],
      "additionalProperties": false,
      "properties": {
        "wavelength_nm": { "type": "number", "exclusiveMinimum": 0, "description": "e.g. 632.8 (HeNe), 650 (diode)." },
        "power_mw": { "type": "number", "exclusiveMinimum": 0, "maximum": 5, "description": "Optical power at the crystal (mW). Capped at 5 mW (Class 3R ceiling) for this schema; higher-power work is out of scope of the v3 programme." },
        "laser_class": { "type": "string", "enum": ["1", "1M", "2", "2M", "3R"], "description": "IEC 60825 class of the source as operated. Class 3B/4 intentionally not representable." },
        "interlock_present": { "type": "boolean", "description": "Beam-block / enclosure interlock in place. Must be true for any run with power_mw > 1." },
        "polarization": {
          "type": "object",
          "additionalProperties": false,
          "properties": {
            "type": { "type": "string", "enum": ["linear", "circular_left", "circular_right", "elliptical", "unpolarized"] },
            "stokes": { "type": "array", "minItems": 3, "maxItems": 3, "items": { "type": "number", "minimum": -1, "maximum": 1 }, "description": "Normalized (s1, s2, s3); RSCS-C.9 convention, s3 = +1 is sigma+." },
            "modulated": { "type": "boolean", "description": "True if polarization is modulated during the run." },
            "modulation_hz": { "type": "number", "exclusiveMinimum": 0 }
          }
        },
        "intensity_modulation": {
          "type": "object",
          "additionalProperties": false,
          "properties": {
            "enabled": { "type": "boolean" },
            "frequency_hz": { "type": "number", "exclusiveMinimum": 0 },
            "depth_pct": { "type": "number", "minimum": 0, "maximum": 100 },
            "synchronized_to": { "type": "string", "description": "Clock/trigger source, e.g. 'master_clock', 'coil_A_phase'." }
          }
        }
      }
    },
    "path": {
      "type": "object",
      "required": ["entry_facet", "target"],
      "additionalProperties": false,
      "properties": {
        "entry_facet": { "type": "string", "description": "Facet identifier on the specimen, e.g. 'F3' per specimen geometry record." },
        "entry_point_mm": { "type": "array", "minItems": 3, "maxItems": 3, "items": { "type": "number" }, "description": "Entry point in the crystal-axis frame (mm)." },
        "target": { "type": "string", "enum": ["geometric_center", "prismatic_shaft_prior", "predicted_node", "measured_node", "custom"], "description": "Interior target location. These are DISTINCT locations (node menu, RGCS_CRYSTAL_APPLICATION.md section 3); record which one is addressed." },
        "target_point_mm": { "type": "array", "minItems": 3, "maxItems": 3, "items": { "type": "number" }, "description": "Required when target = custom, or the measured location when target = measured_node." },
        "incidence_angle_deg": { "type": "number", "minimum": 0, "exclusiveMaximum": 90 },
        "refractive_branch": { "type": "string", "enum": ["ordinary", "extraordinary"], "description": "Which index branch the probe polarization sees." },
        "exit_facet": { "type": "string" }
      }
    },
    "direction": { "type": "string", "enum": ["forward", "backward"], "description": "Beam direction for this arm. Directional claims need a paired run with the opposite value." },
    "reversal_pair_id": { "type": "string", "description": "probe_id of the opposite-direction paired run; required before any directional-asymmetry analysis." },
    "expected_mechanisms": {
      "type": "array",
      "minItems": 1,
      "items": {
        "type": "object",
        "required": ["mechanism", "classification"],
        "additionalProperties": false,
        "properties": {
          "mechanism": { "type": "string", "enum": ["photoelastic_phase_modulation", "birefringence_modulation", "photothermal_absorption", "polarization_rotation", "none_expected"], "description": "Conventional mechanism this probe can sense. Quantitative expectations from rgcs_core.optics (photoelastic_index_shift, quartz_acousto_optic_m2)." },
          "classification": { "type": "string", "enum": ["Established", "Derived", "Hypothesis"], "description": "Class of the magnitude estimate, per SCIENTIFIC_CLASSIFICATION_POLICY.md." },
          "predicted_magnitude": { "type": "number" },
          "predicted_units": { "type": "string" },
          "prediction_ref": { "type": "string", "description": "Where the number comes from (function/doc section)." }
        }
      }
    },
    "controls": {
      "type": "array",
      "minItems": 1,
      "items": {
        "type": "string",
        "enum": ["heating_matched_power_off_node", "beam_reversal", "polarization_flip", "coil_phase_flip", "sham_timing", "glass_isotropic_control", "rotated_crystal", "dummy_crystal", "no_drive_baseline"]
      },
      "description": "Controls attached to this probe. Directional claims require at minimum beam_reversal + sham_timing + heating_matched_power_off_node (D6-003)."
    },
    "hypothesis_ids": { "type": "array", "minItems": 1, "items": { "type": "string", "pattern": "^(H-[0-9]{2}[a-z]?|EXPLORATORY)$" }, "description": "CLAIM_REGISTER rows this probe feeds (H-20..H-23 for the Agent 06 optical claims)." },
    "notes": { "type": "string" }
  }
}
